pmid,doi,year,journal,title,substances,include,design,substance,reason,screen_method
33184979,10.1111/dom.14255,2020,"{'title': 'Diabetes, obesity & metabolism', 'iso_abbreviation': 'Diabetes Obes Metab'}","Effects of oral semaglutide on energy intake, food preference, appetite, control of eating and body weight in subjects with type 2 diabetes.",other,False,RCT,other,No addiction/reward outcome; weight-loss/appetite study only,LLM (title/abstract)
32087425,10.1016/j.jpsychires.2020.02.015,2020,"{'title': 'Journal of psychiatric research', 'iso_abbreviation': 'J Psychiatr Res'}",Metabolic measures 12 months after a randomised controlled trial of treatment of clozapine associated obesity and diabetes with exenatide (CODEX).,gambling,False,secondary-analysis,other,No addiction/reward outcome measured,LLM (title/abstract)
31058214,10.1523/ENEURO.0443-18.2019,2019,"{'title': 'eNeuro', 'iso_abbreviation': 'eNeuro'}",Glucagon-Like Peptide-1 Receptor Agonist Treatment Does Not Reduce Abuse-Related Effects of Opioid Drugs.,nicotine,False,preclinical,opioid,Preclinical animal study (mice); no human data,LLM (title/abstract)
30946836,10.1016/j.physbeh.2019.03.029,2019,"{'title': 'Physiology & behavior', 'iso_abbreviation': 'Physiol Behav'}",The effect of glucagon-like peptide-1 (GLP-1) receptor agonists on substance use disorder (SUD)-related behavioural effects of drugs and alcohol: A systematic review.,alcohol;nicotine,False,review,multiple,Preclinical only; all 17 studies used rodents,LLM (title/abstract)
31759971,10.1016/j.brainres.2019.146562,2019,"{'title': 'Brain research', 'iso_abbreviation': 'Brain Res'}",Alcohol-mediated behaviours and the gut-brain axis; with focus on glucagon-like peptide-1.,alcohol;other,False,review,alcohol,Narrative review; no human trial data reported,LLM (title/abstract)
31114170,10.2147/PPA.S187907,2019,"{'title': 'Patient preference and adherence', 'iso_abbreviation': 'Patient Prefer Adherence'}",Patient preferences for glucagon-like peptide 1 receptor-agonist treatment attributes.,gambling,False,review,other,Literature review; no addiction/reward outcome,LLM (title/abstract)
31820328,10.1007/s13300-019-00739-3,2019,"{'title': 'Diabetes therapy : research, treatment and education of diabetes and related disorders', 'iso_abbreviation': 'Diabetes Ther'}",Real-world Effectiveness of Liraglutide vs. Sitagliptin Among Older Patients with Type 2 Diabetes Enrolled in a Medicare Advantage Prescription Drug Plan: A Retrospective Observational Study.,gambling,False,cohort,other,No addiction/reward/consumption outcome reported,LLM (title/abstract)
30615985,10.1016/j.diabet.2018.12.001,2019,"{'title': 'Diabetes & metabolism', 'iso_abbreviation': 'Diabetes Metab'}","Comparative efficacy, safety, and cardiovascular outcomes with once-weekly subcutaneous semaglutide in the treatment of type 2 diabetes: Insights from the SUSTAIN 1-7 trials.",other,False,secondary-analysis,other,"Type 2 diabetes, no addiction/reward outcome",LLM (title/abstract)
30793465,10.1111/dom.13677,2019,"{'title': 'Diabetes, obesity & metabolism', 'iso_abbreviation': 'Diabetes Obes Metab'}",Lower rates of cardiovascular events and mortality associated with liraglutide use in patients treated with basal insulin: A DEVOTE subanalysis (DEVOTE 10).,nicotine,False,secondary-analysis,other,"Cardiovascular outcomes, not addiction/reward",LLM (title/abstract)
30349227,10.2147/COPD.S175145,2018,"{'title': 'International journal of chronic obstructive pulmonary disease', 'iso_abbreviation': 'Int J Chron Obstruct Pulmon Dis'}",Glucagon-like peptide-1 receptor (GLP-1R) signaling ameliorates dysfunctional immunity in COPD patients.,nicotine,False,other,other,No addiction/reward outcome measured; immunology focus only,LLM (title/abstract)
30532570,10.2147/CEOR.S180067,2018,"{'title': 'ClinicoEconomics and outcomes research : CEOR', 'iso_abbreviation': 'Clinicoecon Outcomes Res'}",Cost-effectiveness and budget impact of liraglutide in type 2 diabetes patients with elevated cardiovascular risk: a US-managed care perspective.,gambling,False,secondary-analysis,other,No addiction/reward/consumption outcome reported,LLM (title/abstract)
30187620,10.1111/dom.13522,2018,"{'title': 'Diabetes, obesity & metabolism', 'iso_abbreviation': 'Diabetes Obes Metab'}",Glucagon-like peptide-1 receptor agonists for antipsychotic-associated cardio-metabolic risk factors: A systematic review and individual participant data meta-analysis.,other,False,secondary-analysis,other,"Weight gain outcome, not addiction/reward endpoint",LLM (title/abstract)
30014268,10.1007/s40265-018-0946-y,2018,"{'title': 'Drugs', 'iso_abbreviation': 'Drugs'}","Centrally Acting Agents for Obesity: Past, Present, and Future.",other,False,review,other,Narrative review; no addiction/reward outcomes,LLM (title/abstract)
29999521,10.1111/eci.12996,2018,"{'title': 'European journal of clinical investigation', 'iso_abbreviation': 'Eur J Clin Invest'}",Hypothalamic AMPK and energy balance.,nicotine,False,review,other,Review article; no addiction/reward outcome studied,LLM (title/abstract)
29744818,10.1007/s13300-018-0432-2,2018,"{'title': 'Diabetes therapy : research, treatment and education of diabetes and related disorders', 'iso_abbreviation': 'Diabetes Ther'}",Real-World Clinical Effectiveness and Cost Savings of Liraglutide Versus Sitagliptin in Treating Type 2 Diabetes for 1 and 2&#xa0;Years.,gambling,False,cohort,other,"Type 2 diabetes glycemic control, no addiction outcome",LLM (title/abstract)
29337226,10.1016/j.neuropharm.2018.01.013,2018,"{'title': 'Neuropharmacology', 'iso_abbreviation': 'Neuropharmacology'}",GLP-1 signaling and alcohol-mediated behaviors; preclinical and clinical evidence.,alcohol;other,False,review,alcohol,Narrative review with no original quantitative data,LLM (title/abstract)
28368384,10.1038/nn.4540,2017,"{'title': 'Nature neuroscience', 'iso_abbreviation': 'Nat Neurosci'}",GLP-1 acts on habenular avoidance circuits to control nicotine intake.,nicotine,False,preclinical,nicotine,Preclinical mouse study; no human data,LLM (title/abstract)
28232370,10.1530/EJE-16-0927,2017,"{'title': 'European journal of endocrinology', 'iso_abbreviation': 'Eur J Endocrinol'}",EJE PRIZE 2017: Hypothalamic AMPK: a golden target against obesity?,nicotine,False,review,other,Review article; no addiction/reward outcome reported,LLM (title/abstract)
28266779,10.1111/dom.12932,2017,"{'title': 'Diabetes, obesity & metabolism', 'iso_abbreviation': 'Diabetes Obes Metab'}","Effects of once-weekly semaglutide on appetite, energy intake, control of eating, food preference and body weight in subjects with obesity.",other,False,RCT,other,Weight loss study; no addiction/reward endpoint,LLM (title/abstract)
28351720,10.1016/j.pharmthera.2017.03.014,2017,"{'title': 'Pharmacology & therapeutics', 'iso_abbreviation': 'Pharmacol Ther'}",Estradiol effects on hypothalamic AMPK and BAT thermogenesis: A gateway for obesity treatment?,nicotine,False,review,other,Narrative review; no quantitative addiction outcome data,LLM (title/abstract)
29194917,10.1111/dom.13167,2017,"{'title': 'Diabetes, obesity & metabolism', 'iso_abbreviation': 'Diabetes Obes Metab'}",Treatment of clozapine-associated obesity and diabetes with exenatide in adults with schizophrenia: A randomized controlled trial (CODEX).,gambling,False,RCT,other,No addiction/reward/craving outcome reported,LLM (title/abstract)
28651479,10.1080/13696998.2017.1347793,2017,"{'title': 'Journal of medical economics', 'iso_abbreviation': 'J Med Econ'}",Evaluating the short-term cost-effectiveness of liraglutide versus lixisenatide in patients with type 2 diabetes in the United States.,gambling,False,secondary-analysis,other,No addiction/reward outcome; glycemic control only,LLM (title/abstract)
29024552,10.1002/2327-6924.12519,2017,"{'title': 'Journal of the American Association of Nurse Practitioners', 'iso_abbreviation': 'J Am Assoc Nurse Pract'}",Current pharmacotherapies for obesity: A practical perspective.,alcohol,False,review,other,Narrative review; no addiction/reward outcomes,LLM (title/abstract)
29952523,,2017,"{'title': 'Medizinische Monatsschrift fur Pharmazeuten', 'iso_abbreviation': 'Med Monatsschr Pharm'}",Update Psychopharmacotherapy.,alcohol,False,review,alcohol,Narrative review; no quantitative addiction outcomes reported,LLM (title/abstract)
27528374,10.1053/j.ajkd.2016.06.014,2016,"{'title': 'American journal of kidney diseases : the official journal of the National Kidney Foundation', 'iso_abbreviation': 'Am J Kidney Dis'}",Safety and Efficacy of Incretin-Based Therapies in Patients With&#xa0;Type 2 Diabetes Mellitus and CKD: A Systematic Review&#xa0;and Meta-analysis.,gambling,False,review,other,Systematic review; no addiction/reward outcome,LLM (title/abstract)
26303264,10.1111/adb.12295,2015,"{'title': 'Addiction biology', 'iso_abbreviation': 'Addict Biol'}",The glucagon-like peptide 1 receptor agonist liraglutide attenuates the reinforcing properties of alcohol in rodents.,nicotine,False,preclinical,alcohol,Preclinical rodent study; no human data,LLM (title/abstract)
25998284,10.2337/dc15-0346,2015,"{'title': 'Diabetes care', 'iso_abbreviation': 'Diabetes Care'}",Smoke or fire? Acute pancreatitis and the liraglutide trials.,nicotine,False,review,other,"Editorial/commentary on pancreatitis safety, no addiction outcome",LLM (title/abstract)
25198217,,2014,"{'title': 'The Journal of family practice', 'iso_abbreviation': 'J Fam Pract'}",Evolving directions in obesity management.,nicotine,False,review,other,No GLP-1 RA studied; no addiction outcome data,LLM (title/abstract)
24133407,10.3389/fnins.2013.00181,2013,"{'title': 'Frontiers in neuroscience', 'iso_abbreviation': 'Front Neurosci'}",The central GLP-1: implications for food and drug reward.,alcohol,False,review,multiple,Narrative review; no human trial data reported,LLM (title/abstract)
23136352,10.1345/aph.1Q789,2012,"{'title': 'The Annals of pharmacotherapy', 'iso_abbreviation': 'Ann Pharmacother'}",Pancreatitis: a potential complication of liraglutide?,alcohol,False,review,other,Narrative review; no addiction/reward outcome studied,LLM (title/abstract)
19703814,10.4158/EP09104.CRR,2010,"{'title': 'Endocrine practice : official journal of the American College of Endocrinology and the American Association of Clinical Endocrinologists', 'iso_abbreviation': 'Endocr Pract'}",Exenatide-induced acute pancreatitis.,alcohol,False,case-report,other,Case report; no addiction/reward outcome measured,LLM (title/abstract)
