pmid,doi,year,journal,title,design,molecule,indication,comparator,substance,outcome,direction,N_exposed,N_comparator,effect_type,effect_est,ci_low,ci_high,p_value,followup,poolable,quote,ehr_flag,audit_status,audit_note,direction_final
39415416,10.1111/add.16679,2024,"{'title': 'Addiction (Abingdon, England)', 'iso_abbreviation': 'Addiction'}",The association between glucose-dependent insulinotropic polypeptide and/or glucagon-like peptide-1 receptor agonist prescriptions and substance-related outcomes in patients with opioid and alcohol use disorders: A real-world data analysis.,cohort,"GIP/GLP-1 receptor agonists (unspecified agents, class-level exposure)",mixed,none,multiple,incidence of opioid overdose (OUD cohort) and alcohol intoxication (AUD cohort),benefit,,,RR,,,,,January 2014 to September 2022,no,Patients with GIP/GLP-1 RA prescriptions demonstrated statistically significantly lower rates of opioid overdose [adjusted incidence rate ratio (aIRR) in OUD patients: 0.60; 95% confidence interval (CI) = 0.43-0.83] and alcohol intoxication (aIRR in AUD patients: 0.50; 95% CI = 0.40-0.63) compared to those without such prescriptions.,False,,,benefit
39764544,10.1016/j.eclinm.2024.102920,2024,"{'title': 'EClinicalMedicine', 'iso_abbreviation': 'EClinicalMedicine'}",Association between glucagon-like peptide-1 receptor agonists use and change in alcohol consumption: a systematic review.,secondary-analysis,"multiple GLP-1 RAs (exenatide, dulaglutide, others)",mixed,placebo,alcohol,heavy drinking days / alcohol consumption,mixed,38740.0,49450.0,,,,,,24 weeks (primary RCT),no,"RCT data did not show a reduction in alcohol consumption over 30 days after 24 weeks of treatment with exenatide versus placebo (heavy drinking days 6.0 [higher in control group], 95% CI -7.4 to 19.4, p = 0.37), a subgroup analysis found a positive effect in people with obesity (BMI >30 kg/m), with significant reductions in brain reward centre cue reactivity on fMRI.",False,,,mixed
39429118,10.1080/17512433.2024.2418398,2024,"{'title': 'Expert review of clinical pharmacology', 'iso_abbreviation': 'Expert Rev Clin Pharmacol'}",Semaglutide and smoking cessation in individuals with type 2 diabetes mellitus: there is no smoke without fire!,secondary-analysis,semaglutide,T2D,active,nicotine,medical encounters for tobacco use disorder,benefit,,,,,,,,,abstract-insufficient,"Wang and colleagues found that semaglutide use was associated with a significantly lower risk for medical encounters for TUD, when compared to other antidiabetic drug classes",False,,,benefit
39288591,10.1016/j.drugalcdep.2024.112424,2024,"{'title': 'Drug and alcohol dependence', 'iso_abbreviation': 'Drug Alcohol Depend'}",Potential role of glucagon-like peptide-1 (GLP-1) receptor agonists in substance use disorder: A systematic review of randomized trials.,secondary-analysis,Exenatide/Dulaglutide,mixed,none,multiple,substance use disorder (alcohol and nicotine use),mixed,630.0,,,,,,,,abstract-insufficient,"Therapeutic effect of GLP-1RA on SUD was assessed in 5 studies, with 3 demonstrating a significant decrease in SUD (alcohol and nicotine).",False,,,mixed
39246719,10.1016/j.eclinm.2024.102777,2024,"{'title': 'EClinicalMedicine', 'iso_abbreviation': 'EClinicalMedicine'}",Incidence of new onset type 2 diabetes in adults living with obesity treated with tirzepatide or semaglutide: real world evidence from an international retrospective cohort study.,cohort,tirzepatide vs semaglutide,T2D,active,,,,6923.0,6923.0,,,,,,12 months,no,"This abstract does not report any addiction- or reward-related outcome (e.g., alcohol, nicotine, gambling, opioid, stimulant, or cannabis use); it reports incidence of type 2 diabetes and cardiovascular outcomes only.",True,EXCLUDE,"reclass of 6 unclassified: Wrong outcome (T2D incidence / CV, not addiction/reward). Co",EXCLUDED
37579116,10.1097/ADM.0000000000001147,2023,"{'title': 'Journal of addiction medicine', 'iso_abbreviation': 'J Addict Med'}","Feasibility of Exenatide, a GLP-1R Agonist, for Treating Cocaine Use Disorder: A Case Series Study.",single-arm,exenatide,other,before-after,stimulant,cocaine use and related clinical effects,mixed,3.0,,,,,,,6 weeks,abstract-insufficient,"Results for cocaine use and related clinical effects were more mixed, yet encouraging.",False,,,mixed
36655300,10.1002/oby.23673,2023,"{'title': 'Obesity (Silver Spring, Md.)', 'iso_abbreviation': 'Obesity (Silver Spring)'}",Two-year effect of semaglutide 2.4&#xa0;mg on control of eating in adults with overweight/obesity: STEP 5.,RCT,semaglutide,obesity,placebo,other,"Control of Eating Questionnaire domain scores (e.g., Craving Control, Craving for Savory)",benefit,88.0,86.0,,,,,p<0.01,104 weeks,abstract-insufficient,"Scores significantly improved with semaglutide versus placebo for Craving Control and Craving for Savory domains at weeks 20, 52, and 104 (p<0.01)",False,,,benefit
38264360,10.1136/bmjnph-2023-000781,2023,"{'title': 'BMJ nutrition, prevention & health', 'iso_abbreviation': 'BMJ Nutr Prev Health'}",Gender differences in weight gain during attempted and successful smoking cessation on dulaglutide treatment: a predefined secondary analysis of a randomised trial.,secondary-analysis,dulaglutide,TUD,placebo,nicotine,substantial postcessation weight gain (>6% body weight increase),benefit,127.0,128.0,OR,0.04,,,<0.001,12 weeks,no,"Female patients were less likely to have substantial weight gain on dulaglutide compared with placebo (1% (n=1/83) vs 24% (n=17/72); p<0.001), while this dulaglutide effect was less pronounced in males (0% (n=0/44) vs 5% (n=3/56); p=0.333).",False,no-effect,"this record's outcome is weight gain, not the cessation/addiction endpoint",no-effect
38017205,10.1038/s41598-023-48267-2,2023,"{'title': 'Scientific reports', 'iso_abbreviation': 'Sci Rep'}",Semaglutide and Tirzepatide reduce alcohol consumption in individuals with obesity.,single-arm,Semaglutide and Tirzepatide,obesity,before-after,alcohol,"self-reported alcohol intake, drinks per drinking episode, binge drinking odds, and AUDIT score",benefit,,,,,,,,≥30 days,abstract-insufficient,"we observe a significantly lower self-reported intake of alcohol, drinks per drinking episode, binge drinking odds, Alcohol Use Disorders Identification Test (AUDIT) scores, and stimulating, and sedative effects in the Semaglutide or Tirzepatide group when compared to prior to starting medication timepoint (within-subjects) and the control group (between-subjects).",False,,,benefit
37991022,10.1172/jci.insight.170419,2023,"{'title': 'JCI insight', 'iso_abbreviation': 'JCI Insight'}",Effects of dulaglutide on alcohol consumption during smoking cessation.,secondary-analysis,dulaglutide,TUD,placebo,alcohol,alcohol consumption,benefit,76.0,75.0,RR,0.71,0.52,0.97,0.04,12 weeks,yes,"At week 12, participants receiving dulaglutide drank 29% less (relative effect = 0.71, 95% CI 0.52-0.97, P = 0.04) than participants receiving placebo.",False,,,benefit
37316311,10.1136/bmjopen-2023-072707,2023,"{'title': 'BMJ open', 'iso_abbreviation': 'BMJ Open'}","Exenatide as an adjunct to nicotine patch for smoking cessation and prevention of postcessation weight gain among treatment-seeking smokers with pre-diabetes and/or overweight: study protocol for a randomised, placebo-controlled clinical trial.",RCT,exenatide,TUD,placebo,nicotine,4-week continuous abstinence,mixed,108.0,108.0,,,,,,"14 weeks (end of treatment), with 12-week post-treatment follow-up",abstract-insufficient,The primary outcomes are 4-week continuous abstinence and changes in body weight at the end of treatment.,False,,,mixed
36066977,10.1172/jci.insight.159863,2022,"{'title': 'JCI insight', 'iso_abbreviation': 'JCI Insight'}","Exenatide once weekly for alcohol use disorder investigated in a randomized, placebo-controlled clinical trial.",RCT,exenatide,AUD,placebo,alcohol,heavy drinking days,no-effect,,,,,,,,26 weeks,abstract-insufficient,"Our data revealed that although exenatide did not significantly reduce the number of heavy drinking days compared with placebo, it significantly attenuated fMRI alcohol cue reactivity in the ventral striatum and septal area, which are crucial brain areas for drug reward and addiction.",False,,,no-effect
33831213,10.1093/ntr/ntab066,2021,"{'title': 'Nicotine & tobacco research : official journal of the Society for Research on Nicotine and Tobacco', 'iso_abbreviation': 'Nicotine Tob Res'}",Exenatide Adjunct to Nicotine Patch Facilitates Smoking Cessation and May Reduce Post-Cessation Weight Gain: A Pilot Randomized Controlled Trial.,RCT,exenatide,TUD,placebo,nicotine,7-day point prevalence smoking abstinence,benefit,42.0,42.0,RR,1.7,0.96,3.27,,6 weeks,yes,"Exenatide increased the risk for smoking abstinence compared to placebo (46.3% and 26.8%, respectively), (risk ratio [RR] = 1.70; 95% credible interval = [0.96, 3.27]; PP = 96.5%).",False,,,benefit
33621809,10.1016/j.drugalcdep.2021.108614,2021,"{'title': 'Drug and alcohol dependence', 'iso_abbreviation': 'Drug Alcohol Depend'}",Testing the effects of the GLP-1 receptor agonist exenatide on cocaine self-administration and subjective responses in humans with cocaine use disorder.,single-arm,exenatide,other,placebo,stimulant,cocaine self-administration (infusions),no-effect,13.0,13.0,MD,-0.6,,,0.39,"acute (single session, 3-h pre-treatment)",no,"Acute pretreatment with exenatide versus placebo did not change cocaine infusions (8.5 ± 1.2 vs. 9.1 ± 1.2; p = 0.39), self-reported euphoria (4.4 ± 0.8 vs. 4.1 ± 0.8; p = 0.21), or wanting of cocaine (5.6 ± 0.9 vs. 5.4 ± 0.9; p = 0.46).",False,,,no-effect
