pmid,doi,year,journal,title,substances,include,design,substance,reason,screen_method
39086405,10.18502/ijph.v53i7.16050,2024,"{'title': 'Iranian journal of public health', 'iso_abbreviation': 'Iran J Public Health'}",Correlation Study of Glucagon-Like Peptide-1 Receptor Agonists (GLP-1RAs) on Diabetic Patients with Hypertension.,nicotine,False,cohort,other,No addiction/reward/craving outcome reported,LLM (title/abstract)
39529123,10.1186/s12991-024-00527-9,2024,"{'title': 'Annals of general psychiatry', 'iso_abbreviation': 'Ann Gen Psychiatry'}",Glucagon-like peptide-1 receptor agonists (GLP-1RAs) as treatment for nicotine cessation in psychiatric populations: a systematic review.,nicotine;other,False,review,nicotine,Systematic review; no original quantitative human data,LLM (title/abstract)
39415416,10.1111/add.16679,2024,"{'title': 'Addiction (Abingdon, England)', 'iso_abbreviation': 'Addiction'}",The association between glucose-dependent insulinotropic polypeptide and/or glucagon-like peptide-1 receptor agonist prescriptions and substance-related outcomes in patients with opioid and alcohol use disorders: A real-world data analysis.,alcohol;other,True,cohort,multiple,Real-world cohort; GLP-1 RA; opioid overdose and alcohol intoxication outcomes,LLM (title/abstract)
39959894,10.1227/neuprac.0000000000000098,2024,"{'title': 'Neurosurgery practice', 'iso_abbreviation': 'Neurosurg Pract'}",GLP-1 Receptor Agonists: Beyond Diabetes-What the Neurosurgeon Needs to Know.,other,False,review,multiple,Narrative review; no quantitative addiction outcome data reported,LLM (title/abstract)
39764544,10.1016/j.eclinm.2024.102920,2024,"{'title': 'EClinicalMedicine', 'iso_abbreviation': 'EClinicalMedicine'}",Association between glucagon-like peptide-1 receptor agonists use and change in alcohol consumption: a systematic review.,alcohol,True,secondary-analysis,alcohol,Systematic review of GLP-1 RAs and alcohol consumption with quantitative outcomes,LLM (title/abstract)
40486798,10.1016/j.jseint.2024.10.006,2024,"{'title': 'JSES international', 'iso_abbreviation': 'JSES Int'}",Improved total shoulder arthroplasty outcomes associated with semaglutide utilization in patients with type II diabetes: a promising new addition to preoperative optimization.,nicotine,False,other,other,No addiction/reward outcome measured,LLM (title/abstract)
39743126,10.1016/j.pcad.2024.12.010,2024,"{'title': 'Progress in cardiovascular diseases', 'iso_abbreviation': 'Prog Cardiovasc Dis'}","Anti-consumption agents: Tirzepatide and semaglutide for treating obesity-related diseases and addictions, and improving life expectancy.",alcohol;nicotine;other,False,review,multiple,Narrative review; no quantitative addiction outcomes reported,LLM (title/abstract)
39594606,10.3390/cells13221857,2024,"{'title': 'Cells', 'iso_abbreviation': 'Cells'}",Semaglutide Ameliorates Diabetic Neuropathic Pain by Inhibiting Neuroinflammation in the Spinal Cord.,other,False,preclinical,other,Preclinical animal study only; no human data,LLM (title/abstract)
39096466,10.1007/s40263-024-01111-1,2024,"{'title': 'CNS drugs', 'iso_abbreviation': 'CNS Drugs'}",Pharmacological Treatment of Binge Eating Disorder and Frequent Comorbid Diseases.,alcohol;nicotine,False,review,multiple,Narrative review; no quantitative addiction outcome data,LLM (title/abstract)
39490542,10.1016/j.arthro.2024.09.057,2024,"{'title': 'Arthroscopy : the journal of arthroscopic & related surgery : official publication of the Arthroscopy Association of North America and the International Arthroscopy Association', 'iso_abbreviation': 'Arthroscopy'}",Lower Risk of Postoperative Complications and Rotator Cuff Retear Associated With Semaglutide Use in Patients with Type II Diabetes Mellitus Undergoing Arthroscopic Rotator Cuff Repair.,nicotine,False,secondary-analysis,other,No addiction/reward/consumption outcome reported,LLM (title/abstract)
39429379,10.7759/cureus.69704,2024,"{'title': 'Cureus', 'iso_abbreviation': 'Cureus'}",Semaglutide-Induced Acute Pancreatitis Leading to Death After Four Years of Use.,alcohol,False,other,other,Case report; no addiction/reward outcome,LLM (title/abstract)
39429118,10.1080/17512433.2024.2418398,2024,"{'title': 'Expert review of clinical pharmacology', 'iso_abbreviation': 'Expert Rev Clin Pharmacol'}",Semaglutide and smoking cessation in individuals with type 2 diabetes mellitus: there is no smoke without fire!,nicotine,True,secondary-analysis,nicotine,Secondary analysis of semaglutide and smoking cessation outcomes,LLM (title/abstract)
39335551,10.3390/biomedicines12092039,2024,"{'title': 'Biomedicines', 'iso_abbreviation': 'Biomedicines'}",Modern Challenges in Type 2 Diabetes: Balancing New Medications with Multifactorial Care.,nicotine,False,review,other,Narrative review; no addiction/reward outcome data,LLM (title/abstract)
39320894,10.1001/jamanetworkopen.2024.35247,2024,"{'title': 'JAMA network open', 'iso_abbreviation': 'JAMA Netw Open'}",Semaglutide and Opioid Overdose Risk in Patients With Type 2 Diabetes and Opioid Use Disorder.,alcohol,False,other,opioid,No abstract available; cannot verify study design or quantitative addiction outcome,LLM (title/abstract)
39288591,10.1016/j.drugalcdep.2024.112424,2024,"{'title': 'Drug and alcohol dependence', 'iso_abbreviation': 'Drug Alcohol Depend'}",Potential role of glucagon-like peptide-1 (GLP-1) receptor agonists in substance use disorder: A systematic review of randomized trials.,alcohol;nicotine;other,True,secondary-analysis,multiple,Systematic review of trials; GLP-1RA; addiction outcomes reported,LLM (title/abstract)
39246719,10.1016/j.eclinm.2024.102777,2024,"{'title': 'EClinicalMedicine', 'iso_abbreviation': 'EClinicalMedicine'}",Incidence of new onset type 2 diabetes in adults living with obesity treated with tirzepatide or semaglutide: real world evidence from an international retrospective cohort study.,gambling,True,cohort,other,"Retrospective cohort, GLP-1 RA (tirzepatide/semaglutide), quantitative metabolic outcomes",LLM (title/abstract)
39232425,10.1016/j.ebiom.2024.105284,2024,"{'title': 'EBioMedicine', 'iso_abbreviation': 'EBioMedicine'}","Effects of the glucagon-like peptide-1 receptor agonist dulaglutide on sexuality in healthy men: a randomised, double-blind, placebo-controlled crossover study.",other,False,RCT,other,No addiction/reward/consumption outcome reported,LLM (title/abstract)
39225090,10.1172/JCI178239,2024,"{'title': 'The Journal of clinical investigation', 'iso_abbreviation': 'J Clin Invest'}",GLP-1R-positive neurons in the lateral septum mediate the anorectic and weight-lowering effects of liraglutide in mice.,other,False,preclinical,other,"Preclinical mouse study, no addiction/reward outcome",LLM (title/abstract)
39167395,10.1001/jamapsychiatry.2024.2412,2024,"{'title': 'JAMA psychiatry', 'iso_abbreviation': 'JAMA Psychiatry'}",Semaglutide in Psychiatry-Opportunities and Challenges.,other,False,review,other,No abstract; cannot verify addiction/reward outcome,LLM (title/abstract)
39163055,10.59556/japi.72.0621,2024,"{'title': 'The Journal of the Association of Physicians of India', 'iso_abbreviation': 'J Assoc Physicians India'}",Nonarteritic Anterior Ischemic Optic Neuropathy and Semaglutide: What is This All About?,nicotine,False,review,other,"Editorial/narrative review, no addiction/reward outcome",LLM (title/abstract)
39150432,10.1097/MCO.0000000000001064,2024,"{'title': 'Current opinion in clinical nutrition and metabolic care', 'iso_abbreviation': 'Curr Opin Clin Nutr Metab Care'}",Energy balance and obesity: the emerging role of glucagon like peptide-1 receptor agonists.,other,False,review,other,Narrative review; no addiction/reward outcome,LLM (title/abstract)
37701904,10.3389/fendo.2023.1244432,2023,"{'title': 'Frontiers in endocrinology', 'iso_abbreviation': 'Front Endocrinol (Lausanne)'}",Comparison of the efficacy and safety of 10 glucagon-like peptide-1 receptor agonists as add-on to metformin in patients with type 2 diabetes: a systematic review.,alcohol,False,secondary-analysis,other,No addiction/reward/consumption outcome reported,LLM (title/abstract)
36720576,10.1136/bmjopen-2022-068652,2023,"{'title': 'BMJ open', 'iso_abbreviation': 'BMJ Open'}","Effect of the GLP-1 receptor agonist semaglutide on metabolic disturbances in clozapine-treated or olanzapine-treated patients with a schizophrenia spectrum disorder: study protocol of a placebo-controlled, randomised clinical trial (SemaPsychiatry).",alcohol;nicotine,False,RCT,other,Protocol-only; no addiction/reward outcome data reported,LLM (title/abstract)
36699502,10.3389/fpsyt.2022.1092828,2023,"{'title': 'Frontiers in psychiatry', 'iso_abbreviation': 'Front Psychiatry'}","Insight into the role of the gut-brain axis in alcohol-related responses: Emphasis on GLP-1, amylin, and ghrelin.",alcohol;other,False,review,alcohol,Narrative review; no new quantitative human data reported,LLM (title/abstract)
37579116,10.1097/ADM.0000000000001147,2023,"{'title': 'Journal of addiction medicine', 'iso_abbreviation': 'J Addict Med'}","Feasibility of Exenatide, a GLP-1R Agonist, for Treating Cocaine Use Disorder: A Case Series Study.",other,True,single-arm,stimulant,"GLP-1RA, cocaine addiction, quantitative outcomes reported",LLM (title/abstract)
37030441,10.1016/j.molmet.2023.101718,2023,"{'title': 'Molecular metabolism', 'iso_abbreviation': 'Mol Metab'}",Fibroblast growth factor-21 is required for weight loss induced by the glucagon-like peptide-1 receptor agonist liraglutide in male mice fed high carbohydrate diets.,other,False,preclinical,other,Preclinical animal-only study; no addiction/reward outcome,LLM (title/abstract)
37719854,10.3389/fphar.2023.1180512,2023,"{'title': 'Frontiers in pharmacology', 'iso_abbreviation': 'Front Pharmacol'}",Antismoking agents do not contribute synergistically to semaglutide's ability to reduce alcohol intake in rats.,nicotine,False,preclinical,alcohol,Preclinical rat study; no human data,LLM (title/abstract)
37793464,10.1016/j.bbadis.2023.166908,2023,"{'title': 'Biochimica et biophysica acta. Molecular basis of disease', 'iso_abbreviation': 'Biochim Biophys Acta Mol Basis Dis'}","Head-to-head comparison of BAM15, semaglutide, rosiglitazone, NEN, and calorie restriction on metabolic physiology in female db/db mice.",alcohol,False,preclinical,other,Preclinical study; female db/db mice only,LLM (title/abstract)
37816167,10.2337/dc23-1012,2023,"{'title': 'Diabetes care', 'iso_abbreviation': 'Diabetes Care'}",Cocoa Extract Supplementation and Risk of Type 2 Diabetes: The Cocoa Supplement and Multivitamin Outcomes Study (COSMOS) Randomized Clinical Trial.,nicotine,False,RCT,other,No addiction/reward outcome studied,LLM (title/abstract)
38932879,10.1007/s40200-023-01341-y,2023,"{'title': 'Journal of diabetes and metabolic disorders', 'iso_abbreviation': 'J Diabetes Metab Disord'}",Real-world HbAchanges and prescription characteristics among type 2 diabetes mellitus patients initiating treatment with once weekly semaglutide for diabetes.,gambling,False,other,other,No addiction/reward/consumption outcome reported,LLM (title/abstract)
37011604,10.57187/smw.2023.40060,2023,"{'title': 'Swiss medical weekly', 'iso_abbreviation': 'Swiss Med Wkly'}",Swiss recommendations of the Society for Endocrinology and Diabetes (SGED/SSED) for the treatment of type 2 diabetes mellitus (2023).,nicotine,False,review,other,"Guidelines/recommendations, no addiction/reward outcome",LLM (title/abstract)
36655300,10.1002/oby.23673,2023,"{'title': 'Obesity (Silver Spring, Md.)', 'iso_abbreviation': 'Obesity (Silver Spring)'}",Two-year effect of semaglutide 2.4&#xa0;mg on control of eating in adults with overweight/obesity: STEP 5.,other,True,RCT,other,"GLP-1 RA, eating control/craving outcomes, RCT design",LLM (title/abstract)
37103096,10.21873/invivo.13178,2023,"{'title': 'In vivo (Athens, Greece)', 'iso_abbreviation': 'In Vivo'}",Liraglutide With Metformin Therapy Ameliorates Hepatic Steatosis and Liver Injury in a Mouse Model of Non-alcoholic Steatohepatitis.,alcohol,False,preclinical,other,Preclinical mouse model; no addiction/reward outcome,LLM (title/abstract)
37209859,10.1016/j.bcp.2023.115613,2023,"{'title': 'Biochemical pharmacology', 'iso_abbreviation': 'Biochem Pharmacol'}","Glucagon-like peptide 1 receptor agonist, exendin-4, reduces alcohol-associated fatty liver disease.",alcohol,False,preclinical,alcohol,Animal model study; no human subjects,LLM (title/abstract)
38264360,10.1136/bmjnph-2023-000781,2023,"{'title': 'BMJ nutrition, prevention & health', 'iso_abbreviation': 'BMJ Nutr Prev Health'}",Gender differences in weight gain during attempted and successful smoking cessation on dulaglutide treatment: a predefined secondary analysis of a randomised trial.,nicotine,True,secondary-analysis,nicotine,"RCT secondary analysis, dulaglutide, smoking cessation with weight-gain outcomes",LLM (title/abstract)
38060149,10.1007/s13300-023-01509-y,2023,"{'title': 'Diabetes therapy : research, treatment and education of diabetes and related disorders', 'iso_abbreviation': 'Diabetes Ther'}",Durability of Effectiveness Between Users of Once-Weekly Semaglutide and Dipeptidyl Peptidase&#xa0;4 Inhibitors (DPP-4i) in US Adults with Type&#xa0;2 Diabetes.,gambling,False,cohort,other,Purely glycemic/weight-loss; no addiction/reward outcome,LLM (title/abstract)
38017205,10.1038/s41598-023-48267-2,2023,"{'title': 'Scientific reports', 'iso_abbreviation': 'Sci Rep'}",Semaglutide and Tirzepatide reduce alcohol consumption in individuals with obesity.,alcohol;other,True,single-arm,alcohol,"GLP-1/GIP RAs, quantitative AUD outcomes, adults",LLM (title/abstract)
38004203,10.3390/nu15224809,2023,"{'title': 'Nutrients', 'iso_abbreviation': 'Nutrients'}",What Is Food Noise? A Conceptual Model of Food Cue Reactivity.,other,False,review,other,"Narrative review, no quantitative addiction outcome data",LLM (title/abstract)
38002464,10.3390/brainsci13111503,2023,"{'title': 'Brain sciences', 'iso_abbreviation': 'Brain Sci'}",GLP-1 Receptor Agonists and Related Mental Health Issues; Insights from a Range of Social Media Platforms Using a Mixed-Methods Approach.,other,False,other,multiple,"Social media content analysis, not designed human study",LLM (title/abstract)
37991022,10.1172/jci.insight.170419,2023,"{'title': 'JCI insight', 'iso_abbreviation': 'JCI Insight'}",Effects of dulaglutide on alcohol consumption during smoking cessation.,alcohol;nicotine;other,True,secondary-analysis,alcohol,Secondary analysis of RCT; dulaglutide vs placebo; quantitative alcohol consumption outcome,LLM (title/abstract)
37324512,10.3892/etm.2023.12054,2023,"{'title': 'Experimental and therapeutic medicine', 'iso_abbreviation': 'Exp Ther Med'}",Therapeutic management of atypical antipsychotic&#x2011;related metabolic dysfunctions using GLP&#x2011;1 receptor agonists: A systematic review.,nicotine,False,review,other,No addiction/reward outcome reported,LLM (title/abstract)
37316311,10.1136/bmjopen-2023-072707,2023,"{'title': 'BMJ open', 'iso_abbreviation': 'BMJ Open'}","Exenatide as an adjunct to nicotine patch for smoking cessation and prevention of postcessation weight gain among treatment-seeking smokers with pre-diabetes and/or overweight: study protocol for a randomised, placebo-controlled clinical trial.",nicotine,True,RCT,nicotine,Protocol-stage RCT of GLP-1RA + nicotine patch for smoking cessation,LLM (title/abstract)
37295046,10.1016/j.ebiom.2023.104642,2023,"{'title': 'EBioMedicine', 'iso_abbreviation': 'EBioMedicine'}",Semaglutide reduces alcohol intake and relapse-like drinking in male and female rats.,alcohol,False,preclinical,alcohol,Preclinical animal study; rodents and mice only,LLM (title/abstract)
37113745,10.1177/20451253231165169,2023,"{'title': 'Therapeutic advances in psychopharmacology', 'iso_abbreviation': 'Ther Adv Psychopharmacol'}",Semaglutide for the treatment of antipsychotic-associated weight gain in patients not responding to metformin - a case series.,other,False,single-arm,other,No addiction/reward/consumption outcome measured,LLM (title/abstract)
37271131,10.1159/000531379,2023,"{'title': 'Nephron', 'iso_abbreviation': 'Nephron'}",Chronic Kidney Disease and Obesity.,nicotine,False,review,other,No addiction/reward outcome; weight-loss focus only,LLM (title/abstract)
37192005,10.1172/jci.insight.170671,2023,"{'title': 'JCI insight', 'iso_abbreviation': 'JCI Insight'}",The glucagon-like peptide-1 (GLP-1) analogue semaglutide reduces alcohol drinking and modulates central GABA neurotransmission.,alcohol;other,False,preclinical,alcohol,Rodent-only study; no human data,LLM (title/abstract)
37129617,10.1007/s00213-023-06376-w,2023,"{'title': 'Psychopharmacology', 'iso_abbreviation': 'Psychopharmacology (Berl)'}",Liraglutide attenuates nicotine self-administration as well as nicotine seeking and hyperphagia during withdrawal in male and female rats.,nicotine,False,preclinical,nicotine,Preclinical rat study; no human data,LLM (title/abstract)
37148870,10.1016/j.celrep.2023.112466,2023,"{'title': 'Cell reports', 'iso_abbreviation': 'Cell Rep'}",GLP-1 and nicotine combination therapy engages hypothalamic and mesolimbic pathways to reverse obesity.,nicotine,False,preclinical,nicotine,Preclinical study; no human data reported,LLM (title/abstract)
35385337,10.1126/scitranslmed.abj9625,2022,"{'title': 'Science translational medicine', 'iso_abbreviation': 'Sci Transl Med'}",A proteomic surrogate for cardiovascular outcomes that is sensitive to multiple mechanisms of change in risk.,nicotine,False,other,other,"Cardiovascular outcomes, not addiction/reward endpoints",LLM (title/abstract)
36555387,10.3390/ijms232415743,2022,"{'title': 'International journal of molecular sciences', 'iso_abbreviation': 'Int J Mol Sci'}",The Influence of Lifestyle and Treatment on Oxidative Stress and Inflammation in Diabetes.,nicotine,False,review,other,Narrative review; no addiction/reward outcome,LLM (title/abstract)
36410565,10.1016/j.brainresbull.2022.11.012,2022,"{'title': 'Brain research bulletin', 'iso_abbreviation': 'Brain Res Bull'}","Sleep is increased by liraglutide, a glucagon-like peptide-1 receptor agonist, in rats.",other,False,preclinical,opioid,Animal-only study; no human data,LLM (title/abstract)
36239850,10.1007/s13300-022-01322-z,2022,"{'title': 'Diabetes therapy : research, treatment and education of diabetes and related disorders', 'iso_abbreviation': 'Diabetes Ther'}",Increased Healthcare Resource Use and Costs After Discontinuation of Liraglutide in Patients with Type 2 Diabetes from a Commercial- and Medicaid-Insured Claims Database.,gambling,False,cohort,other,Type 2 diabetes glycemic control only; no addiction/reward outcome,LLM (title/abstract)
36066977,10.1172/jci.insight.159863,2022,"{'title': 'JCI insight', 'iso_abbreviation': 'JCI Insight'}","Exenatide once weekly for alcohol use disorder investigated in a randomized, placebo-controlled clinical trial.",alcohol;other,True,RCT,alcohol,"RCT, exenatide vs placebo, AUD primary outcome, adults",LLM (title/abstract)
36038016,10.1016/j.brainresbull.2022.08.022,2022,"{'title': 'Brain research bulletin', 'iso_abbreviation': 'Brain Res Bull'}","Dose titration with the glucagon-like peptide-1 agonist, liraglutide, reduces cue- and drug-induced heroin seeking in high drug-taking rats.",other,False,preclinical,opioid,Rodent model study; no human data,LLM (title/abstract)
36031011,10.1016/j.brainresbull.2022.08.023,2022,"{'title': 'Brain research bulletin', 'iso_abbreviation': 'Brain Res Bull'}","Acute treatment with the glucagon-like peptide-1 receptor agonist, liraglutide, reduces cue- and drug-induced fentanyl seeking in rats.",other,False,preclinical,opioid,Preclinical animal study; rats only,LLM (title/abstract)
35914543,10.1016/S2213-8587(22)00188-7,2022,"{'title': 'The lancet. Diabetes & endocrinology', 'iso_abbreviation': 'Lancet Diabetes Endocrinol'}","Efficacy and safety of tirzepatide monotherapy compared with dulaglutide in Japanese patients with type 2 diabetes (SURPASS J-mono): a double-blind, multicentre, randomised, phase 3 trial.",nicotine,False,RCT,other,No addiction/reward outcome reported,LLM (title/abstract)
35695511,10.1097/FBP.0000000000000685,2022,"{'title': 'Behavioural pharmacology', 'iso_abbreviation': 'Behav Pharmacol'}","Acute glucagon-like peptide-1 receptor agonist liraglutide prevents cue-, stress-, and drug-induced heroin-seeking in rats.",nicotine;other,False,preclinical,opioid,Rat study; preclinical animal model only,LLM (title/abstract)
33741445,10.1016/j.pnpbp.2021.110303,2021,"{'title': 'Progress in neuro-psychopharmacology & biological psychiatry', 'iso_abbreviation': 'Prog Neuropsychopharmacol Biol Psychiatry'}","The therapeutic potential of GLP-1 analogues for stress-related eating and role of GLP-1 in stress, emotion and mood: a review.",other,False,review,other,Narrative review; no quantitative addiction/reward outcomes reported,LLM (title/abstract)
34473645,10.1172/JCI151800,2021,"{'title': 'The Journal of clinical investigation', 'iso_abbreviation': 'J Clin Invest'}",A randomized controlled trial of the GLP-1 receptor agonist dulaglutide in primary polydipsia.,alcohol;other,False,RCT,other,Primary polydipsia is not addiction/reward outcome,LLM (title/abstract)
34149258,10.2337/ds20-0025,2021,"{'title': 'Diabetes spectrum : a publication of the American Diabetes Association', 'iso_abbreviation': 'Diabetes Spectr'}",Exploring Why People With Type 2 Diabetes Do or Do Not Persist With Glucagon-Like Peptide-1 Receptor Agonist Therapy: A Qualitative Study.,gambling,False,other,other,Qualitative study; no quantitative addiction/reward outcome,LLM (title/abstract)
34082399,10.1016/j.biopha.2021.111789,2021,"{'title': 'Biomedicine & pharmacotherapy = Biomedecine & pharmacotherapie', 'iso_abbreviation': 'Biomed Pharmacother'}",Diets and drugs for weight loss and health in obesity - An update.,other,False,review,other,Review article; no addiction/reward outcome data reported,LLM (title/abstract)
33831213,10.1093/ntr/ntab066,2021,"{'title': 'Nicotine & tobacco research : official journal of the Society for Research on Nicotine and Tobacco', 'iso_abbreviation': 'Nicotine Tob Res'}",Exenatide Adjunct to Nicotine Patch Facilitates Smoking Cessation and May Reduce Post-Cessation Weight Gain: A Pilot Randomized Controlled Trial.,nicotine,True,RCT,nicotine,"GLP-1 RA + NRT RCT; smoking abstinence, craving, withdrawal outcomes",LLM (title/abstract)
34954521,10.1016/j.bbrc.2021.12.064,2021,"{'title': 'Biochemical and biophysical research communications', 'iso_abbreviation': 'Biochem Biophys Res Commun'}",A mouse model of weight gain after nicotine withdrawal.,nicotine,False,preclinical,nicotine,"Mouse model only, no human study data",LLM (title/abstract)
33687487,10.1007/s00125-021-05392-9,2021,"{'title': 'Diabetologia', 'iso_abbreviation': 'Diabetologia'}","Efficacy and safety of PEGylated exenatide injection (PB-119) in treatment-naive type 2 diabetes mellitus patients: a Phase II randomised, double-blind, parallel, placebo-controlled study.",alcohol,False,RCT,other,Type 2 diabetes glycemic control; no addiction/reward outcome,LLM (title/abstract)
33229892,10.1097/FBP.0000000000000609,2021,"{'title': 'Behavioural pharmacology', 'iso_abbreviation': 'Behav Pharmacol'}","Glucagon-like peptide-1 receptor agonist, exendin-4, reduces reinstatement of heroin-seeking behavior in rats.",nicotine,False,preclinical,opioid,Rat study; preclinical animal model only,LLM (title/abstract)
33269530,10.1111/dom.14280,2021,"{'title': 'Diabetes, obesity & metabolism', 'iso_abbreviation': 'Diabetes Obes Metab'}","The effect of semaglutide 2.4 mg once weekly on energy intake, appetite, control of eating, and gastric emptying in adults with obesity.",other,False,RCT,other,No addiction/reward outcome measured,LLM (title/abstract)
33621809,10.1016/j.drugalcdep.2021.108614,2021,"{'title': 'Drug and alcohol dependence', 'iso_abbreviation': 'Drug Alcohol Depend'}",Testing the effects of the GLP-1 receptor agonist exenatide on cocaine self-administration and subjective responses in humans with cocaine use disorder.,alcohol;gambling;other,True,single-arm,cocaine,"GLP-1 RA, cocaine use disorder, quantitative self-administration outcomes",LLM (title/abstract)
31665455,10.1210/clinem/dgz140,2020,"{'title': 'The Journal of clinical endocrinology and metabolism', 'iso_abbreviation': 'J Clin Endocrinol Metab'}","GLP-1 Analog Modulates Appetite, Taste Preference, Gut Hormones, and Regional Body Fat Stores in Adults with Obesity.",alcohol,False,secondary-analysis,other,"Weight/appetite study, no addiction outcome",LLM (title/abstract)
32124472,10.1111/dme.14287,2020,"{'title': 'Diabetic medicine : a journal of the British Diabetic Association', 'iso_abbreviation': 'Diabet Med'}",Incretin-based drugs and risk of lung cancer among individuals with type 2 diabetes.,nicotine,False,cohort,other,"Lung cancer outcome, not addiction/reward",LLM (title/abstract)
32323451,10.1111/jdi.13281,2020,"{'title': 'Journal of diabetes investigation', 'iso_abbreviation': 'J Diabetes Investig'}",Association of glucagon-like peptide-1 receptor-targeted imaging probe with in&#xa0;vivo glucagon-like peptide-1 receptor agonist glucose-lowering effects.,nicotine,False,preclinical,other,Preclinical animal study; no addiction/reward outcome,LLM (title/abstract)
32583961,10.1111/cts.12839,2020,"{'title': 'Clinical and translational science', 'iso_abbreviation': 'Clin Transl Sci'}",Evolving Role for Pharmacotherapy in NAFLD/NASH.,alcohol,False,review,other,Review article; no addiction/reward outcome,LLM (title/abstract)
32770792,10.1111/adb.12953,2020,"{'title': 'Addiction biology', 'iso_abbreviation': 'Addict Biol'}",Activation of glucagon-like peptide-1 receptors and skilled reach foraging.,alcohol;other,False,preclinical,other,Preclinical animal study; rat model only,LLM (title/abstract)
